{
  "$ref": "#/definitions/mcqs",
  "definitions": {
    "mcqs": {
      "type": "object",
      "properties": {
        "title": {
          "type": "string",
          "minLength": 5,
          "maxLength": 60
        },
        "exam": {
          "type": "string",
          "enum": [
            "ccat",
            "gate-cse"
          ]
        },
        "subject": {
          "type": "string"
        },
        "topic": {
          "type": "string"
        },
        "description": {
          "type": "string",
          "minLength": 120,
          "maxLength": 158
        },
        "relatedCheatsheet": {
          "type": "string"
        },
        "questions": {
          "type": "array",
          "items": {
            "type": "object",
            "properties": {
              "question": {
                "type": "string"
              },
              "options": {
                "type": "array",
                "items": {
                  "type": "string"
                }
              },
              "correct": {
                "type": "integer",
                "minimum": 0
              },
              "explanation": {
                "type": "string"
              }
            },
            "required": [
              "question",
              "options",
              "correct",
              "explanation"
            ],
            "additionalProperties": false
          }
        },
        "$schema": {
          "type": "string"
        }
      },
      "required": [
        "title",
        "exam",
        "subject",
        "topic",
        "description",
        "questions"
      ],
      "additionalProperties": false
    }
  },
  "$schema": "http://json-schema.org/draft-07/schema#"
}